No.,name,problem,content,originallity,appropriateness,pcat1,pcat2,pcat3,ccat1,ccat2,ccat3,select_pcat,no1,no2,no3
70,,新しい業務が始まる際の打ち合わせ、説明等が十分に従業員に伝えられず、実際に業務が始まってから混乱が生じてしまうことが多い。,前もって従業員に説明する機会を設け、意見交換や情報の共有を図る。業務が始まってからも改善点が無いかこまめに近況の確認や話し合いをする機会を設ける。,2,3,5,,,,,,,,,
71,,"私の職場は「報・連・相」の基本ができていません。

簡単な内容も報告・連絡・相談がないため、対応に時間がかかったり、相手に迷惑をかけてしまうことが度々あります。","報告・連絡・相談を素直にするべきだと思います。

私の会社は風通しがとても悪く、隣同士の職員も業務以外のことでは、ほとんど会話をすることがありません。

もっと会社全体が明るく、すこしでも和やかになれば、くだらない報・連・相の欠落はなくなると思います。",2,3,5,,,,,,,,,
72,,塾の講師をしているのですが、上司とアルバイトとの連携がうまくとれていないため、生徒の情報をうまく共有することができていないという問題が発生しています。また、そのような状況のせいで、生徒の塾に対する満足度、継続率も下降傾向にあるという状況です。,まず、職員と講師（アルバイト）間でのコミュニケーションを図る時間を取ることが最優先であると考えています。二者間でのコミュニケーションを取る時間があまりにも少ないため、現状ではうまく連携を図ることができていないと考えています。そこで、事前ミーティング、作業終了後ミーティングなどをもうけることが必須ではないかと考えます。毎日のミーティングの実施が難しい場合、一週間に一回程度の頻度あってもそのような機会を設けて、情報を共有し合う必要があると思います。,2,3,5,,,,,,,,,
73,,個々での仕事が多いのでコミュニケーションが少ないが故に情報伝達が不十分なことがミスの原因になっている。,メールでのやり取りも効率的でいいのだが、見ていない可能性もあるので重要な事や急ぎの要件は直接本人に伝えることで確実になると思う。,2,3,5,,,,,,,,,
74,,小さな雑貨屋で少ない人数で回しているのですが、毎日顔を合わせるのにいつまで経っても仰々しいです。「〇〇さんが〇〇とおっしゃってました」とか、とにかく丁寧な言葉遣いでみんな気を遣いすぎて仕事内容よりもそっちの方がいちいち疲れます。,全然飲み会や食事会が開かれないのでたまにはそういった場を設けて、少し砕けさせた方がいいと思います。,2,3,6,,,,,,,,,
75,,上司の無駄話が多く、作業が滞る。また、終業時間近くになって新しい仕事を始めるので、無駄な残業が発生する。,上司の仕事を全体的にシフトしてもらい、部下から上に流すスタイルにする。,2,3,10,,,,,,,,,
76,,組織内のコミュニケーション不足。コミュニケーションをとらなくても仕事だけすればいいと思っている人が多いため、組織内に好き嫌いが生まれ、全体的にストレスフルな職場環境になっている。,コミュニケーション不足は飲みニケーション不足。飲み会や食事会を行い、堅苦しい雰囲気は禁止にして、相手を知る努力をする。,2,3,4,6,,,,,,,,
77,,"長年働いている女性事務員が、新しく入ってくる事務員に仕事も教えず、いじめ、3年以内に辞めて行く。
若手が育たない。","長年勤務しているからといって人材育成に協力しないのは問題である。
人材育成に関する勉強会を行い、それでも変わらない場合は配置換えもやむ終えないと思う。",2,3,7,9,,,,,,,,
78,,"産休などが整っていない。

女性が多い職場なので、何かしらの派閥ができる","産休に対する意識がまず薄いので意識改革から始めた方がいいと思います。

派閥については、上司のコントロール能力が試されるのかなと感じております",1,2,4,8,,,,,,,,
79,,現場の意見が重要視されない点です。会社内の仕事は、全て関わりあっていると考えていますが、自分の持ち場の仕事だけしていればいい、自分の持ち場の仕事を高めてくれればいいという方針で、お客様の意見や現場の意見は何も聞かれないのが問題だと感じています。,"会社の方針をしっかりと示した上で、現場の意見を聞き変えるとことは変える、変えないところはなぜ変えないか具体的に説明する事が必要だと思う。

会社の方針が、ブレない商品やサービスを提供するために必要なので、私たち現場の人間も理解しておく必要があります。その上で、最も重要なのは現場の人間が聞いているお客様の意見や、お客様の様子から感じられることだと思います。

お互いが妥協点を見つけるまで、何度も話すしかないと考えています。",2,3,5,,,,,,,,,
80,,人材の長期雇用と育成について問題視しています。まず長期雇用について雇用形態が非正規の人材が多いことで長く働く環境が整っていないと感じます。合わせて育成の環境にバラつきがあり、個々の業務対応が一定ではありません。,雇用については正規雇用はもちろん、段階的に給与の上がる仕組みや能力給などがあれば長期の雇用や業務効率に繋がると思います。育成に関してはマニュアル化をして、web上で個々の質疑に対応できる環境ができれば良いのではと考えました。,2,4,9,,,,,,,,,
81,,何かしらのミスが発生した時の、社員間での責任の擦り付け合いがひどい。,ミスに関わった社員は、その割合に関係なく全員で決裁書を提出する決まりにする。,2,3,3,,,,,,,,,
82,,"男女平等とは口ばかりの男社会。

年功序列でいつまでたっても進化しない。チャンスを発揮しにくいから、会社も発展しないと思う。","男女関係なく仕事を振り分け、女性にもどんどん機会を与えてあげるべき。

たいして仕事もできない居座り上司は解雇すべき。

若者の見本となる、できる上司を上に立たせるべきだ。",2,3,10,,,,,,,,,
83,,１フロアーに様々な部署が同居しておりますが、部署毎に業務の負荷や繁忙期が異なるが、暇な部署もあり、その部署のおしゃべりがうるさくて仕方が無い,部署毎の仕切り等を設けて、おしゃべりが与える周りの部署への影響を減らす。,2,3,12,,,,,,,,,
84,,上司との関係性がうまくいかない。仕事もそうですが、休憩中でも職場でリラックス出来ない。,職場にティータイム出来るような場所を作る。例えばコーヒーマシーンを導入したり、ちょっとしたお菓子を置いたりしてほしい。,3,3,6,,,,,,,,,
85,,同じ課の中で連携が取れておらず、別の人間が同じ報告をしてくることがある。,先ずは課のトップが話し易い環境づくりをしたほうがよい。課の中ではあいさつを始め、雑談もできるくらいが好ましいと思う。,2,3,5,,,,,,,,,
86,,個人で仕様できるスペースが少ないので、作業途中で作業する場所を変えないといけないことがあるので、効率が悪いこと。,オフィス内の配置をかえ、共有スペース以外の個人で使えるスペースの確保をする。,2,3,12,,,,,,,,,
87,,"アパレルで仕事をしています。

従業員の声が反映されやすい、楽しく仕事ができる…

そういう所がいいと思って入社しました。

しかし実際は、私は、ある正社員の人によって仕事は一切楽しくない、その上司によって声も反映されない…そのような状態になっています。

ホスピタリティーを持って仕事しましょうと、良く言う割には、全くできていない従業員ばかり…

半年後の目標を立てさせるのに、部下育成は全く出来てない、部下に関心がないのか、育成以外見ない事が多いです。自分から相談しないと、相手にしてもらえないと言ったほうが正しいかもしれません。どうでもいい時は気づくくせに、悩んでたりしても声すらかけない…

従業員一人一人のスキルを理解してないようで、ふる仕事はやりきる事ができないことも多々あります。","まずは、もっと従業員を見るようにしてもらいたいです。そして、ちゃんと部下育成の計画実行してもらいたいです。これは、アイデアでもなんでもないですが…

ホスピタリティーも、お客様に出来るなら従業員にも出来るはずなのでこれもやってもらいたいです。

極論は、上司が上司らしくないのでもっとちゃんとしてほしいです。

仕事はできるかもしれないけど、従業員への指示出し、従業員一人一人をきちんと理解する事、見る事が全くできていないので、そこの改善から必要だと感じます。",1,2,9,,,,,,,,,
88,,女性同志の職場なので団結力は強いが、意志疎通で誤解が生じると解決が難しい,仕事以外は下の名前で呼び合い親交を深め、仕事場では常にお互いを労い綺麗な言葉を使う。,3,3,5,6,,,,,,,,
89,,上司が自分の保身や出世のためだけにいて、部下の役に立っていないこと,上司が部下のためになる様な行動ができるような意識改革、部下に評価されること,2,3,9,,,,,,,,,
90,,部下、社員の意見を真摯に受け止め、考えようとしない上司、役員,個々の提案に対し、全社員の多数決による合意があった場合、議題に対し、真剣に検討する,3,3,4,,,,,,,,,
91,,サービス残業が当然のようになっており、規則上帰っても問題ないのに、いざ帰るとなると白い目で見られること。,1日の業務タスクを日々設定し、タスク処理をしたら帰っても良い仕組みにする。,3,3,6,11,,,,,,,,
92,,スキルがある人でも、自己評価の低い人は給料があがりにくいところです。,"まず、やる気があるただ若い人をリーダーにして、無知な分上司に都合良く使われていて、その下のリーダーより仕事が出来る人でも、それを面談で評価するリーダー自体がやる気だけの人の為、どういったことが出来ているのか把握できていない。



実力があり、ちゃんと見れる人をリーダーにするべきです。縁の下の力持ちが損します。",2,3,8,,,,,,,,,
93,,自分の職場は、職員は同様の仕事をおこなうところなので、仕事量に大きく差が生じても給料は変わらない点に問題があります。,プラスアルファで仕事量を大幅にこなせた場合には給料に反映してもらえる制度を職場でつくってほしいです。,2,4,8,,,,,,,,,
94,,一人一人との交流があんまりなく職場全体の団結心が見られないです。,飲み会など交流を深める場を増やし、仲を深めそれぞれが意見が言えるようになるべき。,2,3,6,,,,,,,,,
95,,長い間習慣になっているものの考え方が上司の間で揺るがないために、新しい風が吹かなくて問題が改善しません。,上司であっても移動を行うことがいいと思います。新しいチームになれば新人の意見にも耳を傾けてもらえるようになると思います。,2,3,10,,,,,,,,,
96,,指導者のスキルが乏しく、人が育たないため余裕がなく簡単なミスが多い。,指導者の教育が必要と思います。厳しくても理屈が合っていて、ルール化されていれば教わる方も納得できます。そのためには、作業を見直してマニュアル化できるスキルが必要と感じます。作業マニュアルや作業標準などあれば、実際の作業を経験しマニュアルで確認ができるので覚えやすいです。作業工程を追求し、マニュアル化することが解決の方法だと思います。,2,3,9,,,,,,,,,
97,,社長と社員との間でのコミュニケーション不足による経営についての考え方のズレ。,社長がもう少し会社に顔を出して、社員とのコミュニケーションをはかること。,2,3,5,,,,,,,,,
98,,全国の会社に勤務していますが、地方の営業所に勤務しています。営業所は人数も少なく一人でもできない人がいると足を引っ張られてしまいます。またそれにより、周囲の人間関係を悪化させることです。,"営業所だけでなく中小企業でもいえることですが、人材の流動性がないところでは一度人間関係が悪化すると異動することが難しく退職するしかなくなってしまします。

そのため

・コミュニケーション取れる上手な人を置く

・強力なリーダーシップを持った上司を置く

などが必要かと思います。",2,3,3,5,,,,,,,,
99,,メールを受け取ると、24時間以内に返信することが暗黙の了解となっている点。残業が増える理由の一つとなっています。,メールが緊急で24時間以内に返事が必要なものなのかそうでないものなのか、メール発信者が件名に明記することで、受信者側の不要な負担が減ると思います。,2,3,10,,,,,,,,,
100,,コミニケーション不足、勤務体制シフトの作り方、人間関係スキル不足、給料関係,月1?2回のミーティング、個人面談、シフトの見直しですこしでも働きやすい職場を作って行く。,2,3,5,8,10,,,,,,,
101,,とにかく会話が少ない。連絡の行き違いがある。メールのように書面を残すのも大切だけれど、人と人とのコミュニケーションは大切。,朝礼や終礼など定期的に全員顔を合わせる機会があればよい。チームで動く物ならばなおさら。誰が何の仕事をしているか、知っておくのも業務の効率化になる。,2,3,5,,,,,,,,,
102,,"一人に対する仕事の量・質

年配の人は大した仕事しないで丸投げにすること",決まったそれぞれの役割を与えること、なおかつそれを管理する人も同時に必要である。,1,2,11,,,,,,,,,
103,,私の職場ではアルバイトと正社員の両方がいる環境ではあるが、正社員に関しては自主的とはいえどあまりにも休みが少ない為正社員のほとんどは疲労困憊している様に伺える。,1.で挙げた正社員に対してアルバイト務めの者は比較的自由に休んでおり、シフトの融通もきくのでみんな明るく、実績もいいものが多い。やはり数字に追われるのもわかるが休む時、働く時、とメリハリを付けて勤務することが実績向上に繋がるのではないかと思う。実際に国外でその様な働き方をしてかつ生産性が高い所は多くある。,2,3,11,,,,,,,,,
104,,上っ面の付き合いで、中身が伴わない会議やコミュニケーションです。,人事考課など評価する人材の選定。仕事の能力だけでなく人間性や協調性を兼ねそろえた人選。,2,3,5,,,,,,,,,
105,,私は、有料老人ホームに長年勤務していますが、私の職場が経営者が家族経営のため社員が思った事を発言しにくい環境にあります。上に立つ経営者が内輪だけで成り立っている感じで平社員はいいなりになっているだけです。このままでは入居している入居者にも不満が溜まってしまいます。,家族以外の社員を1人でもいいので役員にして、みんなをまとめるパイプ役になってもらったらいいと感じます。,2,3,10,,,,,,,,,
106,,男性の社員の間で、情報の共有が十分になされていない点が問題だと感じます。,携帯電話の他、ノートや、メールをより活用することが解決につながると思います。,2,3,5,,,,,,,,,
107,,"人間関係がうまくいかないと

仕事にも影響がでてしまっているところ。","何か嫌なこととかがあった時に

陰で他の人に悪口を

言うのではなくて本人に

直接言ったりして

直してもらうようにする。",2,3,3,,,,,,,,,
108,,事務職の為に、個人プレーで仕事をしている感じがしてました。相談したくてもみんな各自が  必死で質問したい事が聞けなくて困ります。,"まず、自分の知識を高めて自己解決が出来るようになること。

そして、仕事のやり方などに関して気軽に聞ける環境作りです。

その為に仕事以外のコミュニケーションを大切にして仕事でも質問出来やすい環境を作るとよいと思います。",2,3,6,,,,,,,,,
109,,"全体的に何事に関しても緩い。
年齢層が高い。
低賃金の為、モチベーションが上がらない。","仕事量は増えるかもしれないが、人を減らし、一人一人の賃金を上げる。
仕事スピードが遅い人や頭が悪い人がいるので、若年層でやる気のある人材をを雇用するべきです。",2,3,6,,,,,,,,,
110,,昔からの悪い伝統をずっと引き継いで先輩が改善せずに押し付けていること,一度みんなで話し合って根拠のない要領の悪いことを改善するよう話し合う,2,3,10,,,,,,,,,
111,,人間関係、あと給料がかなり少なく休みもほとんどなかったりする。,辞めたいですけど僕の経験上、辞めるわけにもいかないのでそこは耐えます。あと上司に近づかないことですかね。,2,3,3,11,,,,,,,,
112,,情報共有が出来ていないのが問題点です。電話をとった人が言付けを伝え忘れたり、担当者を通さずに勝手に取引先に連絡を取ってそれを担当者に伝えなかったり、チームで仕事をしているということが頭にない人が多いのが問題だと感じています。,情報共有という基本中の基本が出来ていないので、後回しにしないでどんな情報でもホワイトボードに日付とともに記録する習慣をつければ良いと思います。,2,4,5,,,,,,,,,
113,,出社する社員の顔が眠そうで、朝から元気が感じられないことが問題。,早朝出社した社員に対して、朝食無料サービスを提供し、朝から元気をチャージしてもらう。,3,4,6,,,,,,,,,
114,,上下関係の徹底により、意見を言わないことやイエスマンの人が評価されること。,個々の仕事の成果で報酬を決めること。年功序列なのがコミュニケーションを阻害する。,2,3,10,,,,,,,,,
115,,個人がもくもくと机に向かって作業していて、雑談したり和やかな雰囲気が作れていない。,気軽にコミュニケーションがとれるように、カジュアルな雰囲気のミーティングスペースを作る。,3,3,6,,,,,,,,,
116,,職場での上司などの人の上に立つ人間が、まともに仕事をしてない。,ある程度の年齢に達した人達には出世ができないコースに進んでもらい、若い子達にスポットライトを当てるべき。,3,3,10,,,,,,,,,
117,,コミュニケーション。持病や障がいがある人の受け入れ方や接し方。,"何気ない会話やあかるい雰囲気づくり、誰でも受け入れるというおおらかさ。
時には自虐ネタや駄洒落も入って当然という空気が必要。",2,3,5,,,,,,,,,
118,,一般的なイメージで業務内容が簡単だと応募してくる人が多いのですが、実際は覚えることが多く、すぐ辞めてしまうこと。人が定着しない。,どこの職場も新しく始めれば覚えることがあるのは同じなので、習うより慣れろで、仕事しながら繰り返し覚えていくしかないと思う。また、指導者や周りのスタッフがフォローするよう根気よく続けていく。,1,3,9,,,,,,,,,
119,,上司と部下のコミュニケーションの悪さ：部下の抱えている悩み・提案などを素直に上司に言えないような組織風土がある。,"全社的に従業員の意識度調査を実施して、部門ごと・年代層別に同じような課題があるのかを調べる。

共通の課題であれば、職場改善プロジェクトを立ち上げ、管理者と部下とともにオープンなコミュニケーションができる職場づくりの方法を考える。

特定の部門だけの問題であれば、一年に２回ほどの仕事の目標管理の面接の機会時に何でも言えるような場を管理職が設定する。",2,3,5,6,,,,,,,,
120,,報連相がうまくいっていおらず、コミュニケーションがとれていない。,連絡ノートを使用することや、出勤ボードで連絡事項を記入することで少しは改善されると思う。,2,4,5,,,,,,,,,
121,,デスクに仕切りなどの壁がなく、仕事に集中できないところです。,ある程度、コミュニケーションがとれる高さの仕切りをたて、かつデスクの配置を工夫する。,2,3,12,,,,,,,,,
122,,上司や同僚とコミュニケーションが取りにくい雰囲気があることです。,決められたデスクではなく、自由に席替えができるとコミュニケーションが取りやすくなると思います。,3,3,6,,,,,,,,,
123,,上司や先輩からのパワハラやセクハラまた仕事の催促など当人をせらせす,もっと職場の方々が広い心と視野をもって仕事をすれば環境がよくなりいい,1,2,7,,,,,,,,,
124,,職制の起伏が激しいため、話しかけづらく仕事が円滑に進まない。,職制の起伏が激しいために部下が困っていることを本人に認識させる。,1,2,6,,,,,,,,,
125,,女性が多く、長く働いている女性が権力を持ちやりたい放題やっている点。,社員にも文句を言ってくるため、私たち社員で話し合い、そのパートさんの言いなりにならない、そして、話は全て聞き流し相手にしないようにしていました。,2,3,10,,,,,,,,,
126,,自分の仕事範囲外については、同じ職場なのに分からない、よく知らないと理解しようとしない。,同じ会社内で職場の役割をローテーションで回して、他の人の仕事範囲を理解してはどうかと思う。,3,3,5,,,,,,,,,
127,,私が感じる職場の問題点は、新職員が、長続きせずに、すぐ辞めてしまう事です,新しく入ってきた職員に、丁寧に指導していき、ゆっくりと仕事を覚えてもらう為に、指導する人を一人に決めておけば良いと思います。,2,3,9,,,,,,,,,
128,,年功序列がいまだにいきていて体制が古い。社長のワンマンで誰も社長に意見を言えない。ただ事務員は自由。,簡単にはクビにされることもないのだから、間違っていることは間違っているとはっきり指摘しないとダメだと思う。社内掲示板的なものを作って、簡単にでも問題提起したり、何か気づくきっかけをつくるようにすれば良いと思う。誰も意見を言わないことで本人もそれが間違っていると気付いていない場合も多いと思うので。,2,3,10,,,,,,,,,
129,,新人社員が育たなく、育つ前にやめてしまう。それについて辞めていった人が悪いと上司が思っていること。,まず、誰が新人教育をするのかを役割分担するべき。また、上司が一方的に話すのでなくて新人の理想像も捕らえ話しをすり機会をあたえるべき。カリキュラムの作成。,2,3,9,,,,,,,,,
130,,パートタイマーと職員の間のコミュニケーションが足りないことです。,飴ちゃんやチョコとかつねに持っていて、話のきっかけにすることです。,3,3,6,,,,,,,,,
